{
    "git_ref":  "",
    "ea_id":  "EA-046",
    "config_snapshot":  {
                            "outbound_auth_mode":  "HMAC_SHA256",
                            "compensation_pool_enabled":  true,
                            "default_provider":  "ESIGN_HTTP",
                            "callback_verification_mode":  "TIMESTAMP_NONCE_SIGNATURE",
                            "provider_configured":  true
                        },
    "signed_off_by":  "local-sandbox-runner",
    "scenarios":  [
                      {
                          "api_request_id":  "",
                          "id":  "HEALTH",
                          "passed":  true
                      },
                      {
                          "id":  "LOGIN",
                          "passed":  true
                      },
                      {
                          "provider_configured":  true,
                          "api_request_id":  "ea046-20260601-105059-CONFIG",
                          "id":  "CONFIG",
                          "passed":  true
                      },
                      {
                          "document_id":  "DOC_EA040_SIGN_OK",
                          "id":  "INITIATE",
                          "passed":  true,
                          "platform_trace_id":  "ea046-20260601-105059-INITIATE",
                          "external_sign_ref":  "HTTP-FLOW-4167324ad47748de9ad960fafc819b22",
                          "api_request_id":  "ea046-20260601-105059-INITIATE"
                      },
                      {
                          "external_sign_ref":  "HTTP-FLOW-4167324ad47748de9ad960fafc819b22",
                          "id":  "LOOKUP",
                          "passed":  true
                      },
                      {
                          "external_sign_ref":  "HTTP-FLOW-4167324ad47748de9ad960fafc819b22",
                          "id":  "QUERY_STATUS",
                          "passed":  true
                      },
                      {
                          "idempotency_key":  "EA046-ea046-20260601-105059-CB-1",
                          "external_sign_ref":  "HTTP-FLOW-4167324ad47748de9ad960fafc819b22",
                          "id":  "CALLBACK_REPLAY",
                          "passed":  false
                      },
                      {
                          "id":  "CALLBACK_IDEMPOTENT",
                          "idempotent_replay":  false,
                          "passed":  false
                      },
                      {
                          "external_sign_ref":  "EA046-UNKNOWN-ea046-20260601-105059",
                          "id":  "COMPENSATION_UNKNOWN_REF",
                          "passed":  false
                      },
                      {
                          "error":  "psql:E:/cursor/BR PT/供应链金融管理系统/deploy/pilot/scripts/export-contract-sign-evidence.sql:53: 閿欒:  瀛楁 \"action_code\" 涓嶅瓨鍦?",
                          "id":  "DB_TRACE_EXPORT",
                          "passed":  false
                      }
                  ],
    "environment":  "local-quasi-sandbox",
    "tests":  {
                  "mvn_regression":  "165/165 (EA-045 baseline)",
                  "notes":  "Run EA019RegressionRunner before sandbox sign-off"
              },
    "signed_off_at":  "2026-06-01T02:51:00Z",
    "run_id":  "ea046-20260601-105059",
    "verdict":  "FAIL",
    "vendor":  {
                   "base_url":  "http://127.0.0.1:57646",
                   "name":  "HttpEsignVendorStub",
                   "callback_url":  "",
                   "doc_version":  "EA-046-local"
               }
}
